{
  "protocol_version": "0.1",
  "type": "envelope",
  "id": "env_brand_approvals_handoff",
  "sent_at": "2026-10-12T10:20:00Z",
  "sender": {
    "kind": "agent",
    "id": "https://agents.harborpine.example/planning",
    "display": "Planning agent"
  },
  "recipient": {
    "kind": "agent",
    "id": "https://agents.harborpine.example/coding",
    "display": "Coding agent"
  },
  "correlation": {
    "correlation_id": "brand-approvals"
  },
  "objects": [
    {
      "protocol_version": "0.1",
      "type": "work_contract",
      "id": "wc_brand_approvals",
      "revision": 1,
      "created_at": "2026-10-12T09:00:00Z",
      "scope": {
        "organization": "harborpine.example",
        "workspace": "internal",
        "project": "brand-approvals"
      },
      "profile": "software-delivery/0.1",
      "summary": "Run a scoped experiment: block and record explicit client approval before a branded external project is published, keeping client workspaces isolated. Budget USD 400.00, medium risk, due 2026-10-26.",
      "objective": {
        "outcome": "Agency clients can require their own approval before anything branded goes out, so they keep trusting shared projects.",
        "request": "Add an approval gate to external publishing for branded projects, behind a feature flag, with a preview for the owner."
      },
      "owner": {
        "kind": "person",
        "id": "dana.whitfield",
        "issuer": "https://id.harborpine.example",
        "display": "Dana Whitfield"
      },
      "requester": {
        "kind": "person",
        "id": "dana.whitfield",
        "issuer": "https://id.harborpine.example",
        "display": "Dana Whitfield"
      },
      "stakeholders": [
        {
          "principal": {
            "kind": "person",
            "id": "priya.raman",
            "issuer": "https://id.harborpine.example",
            "display": "Priya Raman"
          },
          "role": "approver",
          "approver_roles": ["product_manager"]
        },
        {
          "principal": {
            "kind": "person",
            "id": "theo.okafor",
            "issuer": "https://id.harborpine.example",
            "display": "Theo Okafor"
          },
          "role": "consulted"
        }
      ],
      "criteria": [
        {
          "id": "AC-1",
          "statement": "Publishing a branded external project is blocked until a client approver has approved it.",
          "required": true,
          "method": "automated_check"
        },
        {
          "id": "AC-2",
          "statement": "Every approval is recorded with the approver, the time and the version approved.",
          "required": true,
          "method": "automated_check"
        },
        {
          "id": "AC-3",
          "statement": "Nothing from one client workspace is visible in another.",
          "required": true,
          "method": "automated_check"
        },
        {
          "id": "AC-4",
          "statement": "The owner reviews the preview and judges the flow usable.",
          "required": true,
          "method": "human_judgment"
        },
        {
          "id": "AC-5",
          "statement": "Pilot clients use the approval gate on at least half of their branded projects.",
          "required": false,
          "method": "measurement_window",
          "measurement": {
            "window_seconds": 2592000,
            "starts": "on_pilot_approval"
          }
        }
      ],
      "constraints": [
        {
          "id": "C-1",
          "kind": "must_not",
          "statement": "Read or write anything in the Lumen Beverages workspace."
        },
        {
          "id": "C-2",
          "kind": "must",
          "statement": "Keep the gate behind a feature flag that is off for clients outside the pilot."
        },
        {
          "id": "C-3",
          "kind": "must_not",
          "statement": "Deploy to production."
        }
      ],
      "deadline_at": "2026-10-26T17:00:00Z",
      "limits": {
        "cost": {
          "currency": "USD",
          "amount": "400.00"
        },
        "risk": {
          "max_level": "medium",
          "notes": "Preview only; nothing reaches clients without the flag."
        }
      },
      "outputs": [
        {
          "id": "OUT-1",
          "kind": "pull_request",
          "description": "A reviewed pull request with the gate."
        },
        {
          "id": "OUT-2",
          "kind": "preview_url",
          "description": "A preview the owner can try."
        }
      ]
    },
    {
      "protocol_version": "0.1",
      "type": "context_manifest",
      "id": "ctx_brand_approvals",
      "revision": 1,
      "created_at": "2026-10-12T09:05:00Z",
      "scope": {
        "organization": "harborpine.example",
        "workspace": "internal",
        "project": "brand-approvals"
      },
      "contract": {
        "id": "wc_brand_approvals",
        "revision": 1
      },
      "purpose": "Ground the experiment in what clients asked for, reading no more than it needs.",
      "items": [
        {
          "id": "item_aster_comments",
          "kind": "workspace_comments",
          "source": {
            "system": "Harbor & Pine workspace comments",
            "ref": "https://app.harborpine.example/api/workspaces/aster-foods/comments?topic=approvals",
            "version": "snapshot-2026-10-12"
          },
          "scope": {
            "organization": "harborpine.example",
            "workspace": "aster-foods"
          },
          "classification": "confidential",
          "provenance": {
            "produced_by": {
              "kind": "agent",
              "id": "https://agents.harborpine.example/research",
              "display": "Research agent"
            },
            "retrieved_at": "2026-10-12T08:40:00Z",
            "method": "api_read"
          },
          "freshness": {
            "as_of": "2026-10-12T08:40:00Z",
            "max_age_seconds": 604800
          },
          "disclosure": {
            "allowed_to": [
              {
                "kind": "agent",
                "id": "https://agents.harborpine.example/planning",
                "display": "Planning agent"
              },
              {
                "kind": "agent",
                "id": "https://agents.harborpine.example/coding",
                "display": "Coding agent"
              },
              "product_team"
            ],
            "redactions": ["commenter names", "email addresses"]
          },
          "minimal": ["comment text about approvals", "comment date"],
          "digest": "sha256:4bc110296d2320f94ffed6f5520bcb8d3407e7fe72f57c3653f182b1e2bf4ea8"
        },
        {
          "id": "item_feedback_board",
          "kind": "feedback_items",
          "source": {
            "system": "Harbor & Pine feedback board",
            "ref": "https://app.harborpine.example/api/feedback?tag=approvals",
            "version": "2026-10-12"
          },
          "scope": {
            "organization": "harborpine.example",
            "workspace": "internal"
          },
          "classification": "internal",
          "provenance": {
            "produced_by": {
              "kind": "agent",
              "id": "https://agents.harborpine.example/research",
              "display": "Research agent"
            },
            "retrieved_at": "2026-10-12T08:45:00Z",
            "method": "api_read"
          },
          "freshness": {
            "as_of": "2026-10-12T08:45:00Z",
            "max_age_seconds": 604800
          },
          "disclosure": {
            "allowed_to": ["product_team"]
          },
          "minimal": ["request titles", "vote counts"]
        },
        {
          "id": "item_aster_approvers",
          "kind": "identity_records",
          "source": {
            "system": "Harbor & Pine identity",
            "ref": "https://id.harborpine.example/api/workspaces/aster-foods/roles/approver",
            "version": "etag-7f3a"
          },
          "scope": {
            "organization": "harborpine.example",
            "workspace": "aster-foods"
          },
          "classification": "restricted",
          "provenance": {
            "produced_by": {
              "kind": "agent",
              "id": "https://agents.harborpine.example/research",
              "display": "Research agent"
            },
            "retrieved_at": "2026-10-12T08:50:00Z",
            "method": "api_read"
          },
          "freshness": {
            "as_of": "2026-10-12T08:50:00Z",
            "max_age_seconds": 604800
          },
          "disclosure": {
            "allowed_to": [
              {
                "kind": "agent",
                "id": "https://agents.harborpine.example/coding",
                "display": "Coding agent"
              }
            ],
            "redactions": ["names"]
          },
          "minimal": ["which client roles may approve"]
        }
      ],
      "known_unknowns": [
        "Whether clients other than Aster Foods want the same gate.",
        "How Quillstone's brand check performs in practice."
      ],
      "excluded": [
        {
          "description": "The Lumen Beverages workspace.",
          "reason": "Not part of the pilot, and no grant covers it."
        }
      ],
      "retention_seconds": 7776000
    },
    {
      "protocol_version": "0.1",
      "type": "authority_binding",
      "id": "auth_coding_agent",
      "revision": 1,
      "created_at": "2026-10-12T10:00:00Z",
      "scope": {
        "organization": "harborpine.example",
        "workspace": "internal",
        "project": "brand-approvals"
      },
      "profile": "software-delivery/0.1",
      "contract": {
        "id": "wc_brand_approvals",
        "revision": 1
      },
      "grantor": {
        "organization": "harborpine.example",
        "person": {
          "kind": "person",
          "id": "dana.whitfield",